{
  "$schema": "https://json-schema.org/draft/2020-12/schema",
  "type": "object",
  "additionalProperties": false,
  "properties": {
    "abstained": {
      "type": "boolean"
    },
    "classification": {
      "enum": [
        "proposed",
        "needs_input",
        "abstained"
      ]
    },
    "reason": {
      "anyOf": [
        {
          "type": "string",
          "minLength": 1
        },
        {
          "type": "null"
        }
      ]
    },
    "goal": {
      "type": "string",
      "minLength": 1
    },
    "assumptions": {
      "type": "array",
      "items": {
        "type": "string",
        "minLength": 1
      },
      "minItems": 0
    },
    "questions": {
      "type": "array",
      "items": {
        "type": "string",
        "minLength": 1
      },
      "minItems": 0
    },
    "criteria": {
      "type": "array",
      "items": {
        "type": "object",
        "additionalProperties": false,
        "properties": {
          "id": {
            "type": "string",
            "minLength": 1
          },
          "description": {
            "type": "string",
            "minLength": 1
          }
        },
        "required": [
          "id",
          "description"
        ]
      },
      "minItems": 0
    },
    "artifacts": {
      "type": "array",
      "items": {
        "type": "object",
        "additionalProperties": false,
        "properties": {
          "id": {
            "type": "string",
            "minLength": 1
          },
          "description": {
            "type": "string",
            "minLength": 1
          },
          "schema": {
            "type": "object"
          }
        },
        "required": [
          "id",
          "description",
          "schema"
        ]
      },
      "minItems": 0
    },
    "inputs": {
      "type": "array",
      "items": {
        "type": "string",
        "minLength": 1
      },
      "minItems": 0
    },
    "outputs": {
      "type": "array",
      "items": {
        "type": "string",
        "minLength": 1
      },
      "minItems": 0
    },
    "steps": {
      "type": "array",
      "items": {
        "type": "object",
        "additionalProperties": false,
        "properties": {
          "id": {
            "type": "string",
            "minLength": 1
          },
          "purpose": {
            "type": "string",
            "minLength": 1
          },
          "capability": {
            "type": "string",
            "minLength": 1
          },
          "inputs": {
            "type": "array",
            "items": {
              "type": "string",
              "minLength": 1
            },
            "minItems": 0
          },
          "outputs": {
            "type": "array",
            "items": {
              "type": "string",
              "minLength": 1
            },
            "minItems": 1
          },
          "choice": {
            "type": "object",
            "additionalProperties": false,
            "properties": {
              "kind": {
                "enum": [
                  "existing",
                  "new",
                  "human",
                  "tool"
                ]
              },
              "cog_id": {
                "anyOf": [
                  {
                    "type": "string",
                    "minLength": 1
                  },
                  {
                    "type": "null"
                  }
                ]
              },
              "catalog_fingerprint": {
                "anyOf": [
                  {
                    "type": "string",
                    "minLength": 1
                  },
                  {
                    "type": "null"
                  }
                ]
              },
              "brief_id": {
                "anyOf": [
                  {
                    "type": "string",
                    "minLength": 1
                  },
                  {
                    "type": "null"
                  }
                ]
              },
              "rationale": {
                "type": "string",
                "minLength": 1
              }
            },
            "required": [
              "kind",
              "cog_id",
              "catalog_fingerprint",
              "brief_id",
              "rationale"
            ]
          },
          "criteria": {
            "type": "array",
            "items": {
              "type": "string",
              "minLength": 1
            },
            "minItems": 1
          }
        },
        "required": [
          "id",
          "purpose",
          "capability",
          "inputs",
          "outputs",
          "choice",
          "criteria"
        ]
      },
      "minItems": 0
    },
    "cog_briefs": {
      "type": "array",
      "items": {
        "type": "object",
        "additionalProperties": false,
        "properties": {
          "id": {
            "type": "string",
            "minLength": 1
          },
          "step_ids": {
            "type": "array",
            "items": {
              "type": "string",
              "minLength": 1
            },
            "minItems": 1
          },
          "name": {
            "type": "string",
            "pattern": "^cog-[a-z0-9]+(?:-[a-z0-9]+)*$"
          },
          "brief": {
            "type": "string",
            "minLength": 1
          },
          "prohibits": {
            "type": "array",
            "items": {
              "type": "string",
              "minLength": 1
            },
            "minItems": 0
          }
        },
        "required": [
          "id",
          "step_ids",
          "name",
          "brief",
          "prohibits"
        ]
      },
      "minItems": 0
    },
    "review_points": {
      "type": "array",
      "items": {
        "type": "string",
        "minLength": 1
      },
      "minItems": 0
    }
  },
  "required": [
    "abstained",
    "classification",
    "reason",
    "goal",
    "assumptions",
    "questions",
    "criteria",
    "artifacts",
    "inputs",
    "outputs",
    "steps",
    "cog_briefs",
    "review_points"
  ]
}
